{"cases":[{"capabilityId":"employee.detail","caseId":"system-emp-admin","status":"success"},{"capabilityId":"employee.detail","caseId":"system-emp-deny","status":"forbidden"},{"capabilityId":null,"caseId":"system-invalid","status":"invalid_argument"},{"capabilityId":"knowledge.query","caseId":"system-k-admin","status":"success"},{"capabilityId":"knowledge.query","caseId":"system-k-deny","status":"forbidden"},{"capabilityId":"transaction.search","caseId":"system-txn-admin","status":"no_result"},{"capabilityId":"transaction.search","caseId":"system-txn-deny","status":"forbidden"}],"cleanup":{"ownedProcessesStopped":true,"rawLogsDeleted":true,"runtimeClosed":true},"failureCode":null,"providers":{"employee":"real","knowledge":"real","model":"stub","transaction":"real"},"requestCounts":{"answerGeneration":0,"embedding":2,"employee":2,"externalModelOutbound":0,"knowledgeSearch":8,"localKnowledgeModel":3,"otherBusinessEndpoints":0,"rerank":1,"transaction":2},"schemaVersion":1,"security":{"logLeakCount":0,"sensitivePersistence":false},"status":"passed","workPackage":"WP-SYSTEM-E2E-01"}